<?xml version="1.0" encoding="UTF-8"?>
<!DOCTYPE OLDL PUBLIC "-//OLDL 0.4//EN" "http://doctype.open-lims.org/oldl.dtd" >
<OLDL type="sample">
	<HEAD>
		<ID>10003</ID>
	 	<TITLE>RNA w. Manufacturer and Location</TITLE>
		<DESC>Organisational RNA Template</DESC>
		<VERSION>draft</VERSION>
		<AUTHOR></AUTHOR>
		<LOCATION />
		<MANUFACTURER />
		<EXPIRY />
	</HEAD>
	<BODY>
	</BODY>
</OLDL>
