<?xml version="1.0" encoding="UTF-8"?>
<!DOCTYPE OLDL PUBLIC "-//OLDL 0.4//EN" "http://doctype.open-lims.org/oldl.dtd" >
<OLDL type="sample">
	<HEAD>
		<ID>10001</ID>
	 	<TITLE>RNA w. Date of Expiry</TITLE>
		<DESC>Organisational RNA Template</DESC>
		<VERSION>draft</VERSION>
		<AUTHOR></AUTHOR>
		<LOCATION requirement="optional" />
		<MANUFACTURER requirement="optional" />
		<EXPIRY />
	</HEAD>
	<BODY>
	</BODY>
</OLDL>
