<?xml version="1.0" encoding="UTF-8"?>
<!DOCTYPE OLDL PUBLIC "-//OLDL 0.4//EN" "http://doctype.open-lims.org/oldl.dtd" >
<OLDL>
	<HEAD>
		<ID>19000</ID>
		<TITLE>MicroArray - Parent Project</TITLE>
		<DESC>Parent Project for different Microarray projects</DESC>
		<VERSION>draft</VERSION>
		<AUTHOR></AUTHOR>
	</HEAD>
	<REQUIRED>  
  	</REQUIRED>
	<BODY>
		<STATUS id="10001"></STATUS>
		<STATUS id="10002"></STATUS>
		<STATUS id="10003"></STATUS>
		<STATUS id="10004"></STATUS>
		<STATUS id="10005"></STATUS>
		<STATUS id="10006"></STATUS>
		<STATUS id="10007"></STATUS>
		<STATUS id="10008"></STATUS>
		<STATUS id="10009"></STATUS>
	</BODY>
</OLDL>